{
  "schema_version": 1,
  "authority": "server",
  "revision": 0,
  "profile": {
    "user_id": "00000000-0000-4000-8000-000000000001",
    "display_name": "Jogador de exemplo",
    "created_at": "2026-10-28T12:00:00Z",
    "updated_at": "2026-10-28T12:00:00Z"
  },
  "campaigns": [
    {
      "campaign_id": "desert_campaign",
      "status": "not_started",
      "completed_phase_ids": [],
      "current_phase_id": null,
      "completed_at": null
    }
  ],
  "phase_completions": [],
  "character_unlocks": [
    {
      "character_id": "cowboy",
      "source": "initial_catalog",
      "source_achievement_id": null,
      "unlocked_at": "2026-10-28T12:00:00Z"
    },
    {
      "character_id": "michelly",
      "source": "initial_catalog",
      "source_achievement_id": null,
      "unlocked_at": "2026-10-28T12:00:00Z"
    },
    {
      "character_id": "rodrigo",
      "source": "initial_catalog",
      "source_achievement_id": null,
      "unlocked_at": "2026-10-28T12:00:00Z"
    },
    {
      "character_id": "lorena",
      "source": "initial_catalog",
      "source_achievement_id": null,
      "unlocked_at": "2026-10-28T12:00:00Z"
    },
    {
      "character_id": "gus",
      "source": "initial_catalog",
      "source_achievement_id": null,
      "unlocked_at": "2026-10-28T12:00:00Z"
    },
    {
      "character_id": "lana",
      "source": "initial_catalog",
      "source_achievement_id": null,
      "unlocked_at": "2026-10-28T12:00:00Z"
    },
    {
      "character_id": "halloween",
      "source": "initial_catalog",
      "source_achievement_id": null,
      "unlocked_at": "2026-10-28T12:00:00Z"
    }
  ],
  "equipped_character_id": "cowboy",
  "achievements": []
}
